754730058913308673	realDonaldTrump	We grieve for the officers killed in Baton Rouge today. How many law enforcement and people have to... https://t.co/pPNrzG8kEa	2016-07-17 20:30:42	iphone
754744188856565760	realDonaldTrump	We are TRYING to fight ISIS, and now our own people are killing our police. Our country is divided and out of control. The world is watching	2016-07-17 21:26:51	android
754747397700485120	realDonaldTrump	I will be on @60Minutes tonight at 7:00 P.M. with Mike Pence talking about LAW AND ORDER and many other subjects! Bad times for divided USA!	2016-07-17 21:39:36	android
754747849737461760	realDonaldTrump	"@60Minutes: DonaldTrump and his running mate @Mike_Pence to appear on #60Minutes in first joint interview. CBS https://t.co/lZH7qw9qmu"	2016-07-17 21:41:24	android
754761101338959873	PressSec	RT @WhiteHouse: .@POTUS on the attack on law enforcement in Baton Rouge: https://t.co/rczTFpblUa https://t.co/zgyPvCS0Na	2016-07-17 22:34:03	<a href="https://about.twitter.com/products/tweetdeck" rel="nofollow">TweetDeck</a>
754785984970002432	PressSec	RT @WhiteHouse: Watch @POTUS give remarks on the attack on law enforcement in Baton Rouge: https://t.co/5I4OiRLJtI	2016-07-18 00:12:56	<a href="https://about.twitter.com/products/tweetdeck" rel="nofollow">TweetDeck</a>
754788362368741376	realDonaldTrump	Our country is totally divided and our enemies are watching. We are not looking good, we are not looking smart, we are not looking tough!	2016-07-18 00:22:23	android
754789482621243392	realDonaldTrump	President Obama just had a news conference, but he doesn't have a clue. Our country is a divided crime scene, and it will only get worse!	2016-07-18 00:26:50	android
743747439954264065	realDonaldTrump	"@VoteTrumpMAGA: The media attack on @realDonaldTrump is relentless. They are desperate. But, they keep #Trump in the news - a good thing.	2016-06-17 13:09:42	android
743761349910487043	realDonaldTrump	Amazing crowd last night in Dallas - more spirit and passion than ever before. Today, all over the great State of Texas!	2016-06-17 14:04:58	android
743765281898536960	realDonaldTrump	People very unhappy with Crooked Hillary and Obama on JOBS and SAFETY! Biggest trade deficit in many years! More attacks will follow Orlando	2016-06-17 14:20:36	android
743766155093934080	realDonaldTrump	MAKE AMERICA GREAT AGAIN! MAKE AMERICA SAFE AGAIN!	2016-06-17 14:24:04	android
619102432648413184	realDonaldTrump	Do you believe that highly overrated political pundit  @krauthammer said this is the best Republican field in 35 years. What a dope!	2015-07-09 14:14:56	android
619105146128179201	realDonaldTrump	Jeb's brother George insisted on a $100,000 fee and $20,000 for a private jet to speak at a charity for severely wounded vets. Not nice!	2015-07-09 14:25:43	android
619116090501799936	realDonaldTrump	You mean George Bush sends our soldiers into combat, they are severely wounded, and then he wants $120,000 to make a boring speech to them?	2015-07-09 15:09:13	android
619116301705969664	realDonaldTrump	"@tranerofmonstrs: @krauthammer He is an openly declared traitor to this nation as are the execs of @Univision and @Macys #LETSDOTHISAMERICA	2015-07-09 15:10:03	android
619116650613329920	realDonaldTrump	"@williamonlyrent: @realDonaldTrump @krauthammer Only good candidate in this GOP field is you sir! Go Trump. #Trump2016" Thank you.	2015-07-09 15:11:26	android
619116814040219648	realDonaldTrump	"@mcgranejt: @realDonaldTrump @krauthammer @ChuckLane1 both fools &amp; out of touch with reality! We need Trump # 45 #MakeAmericaGreatAgain"	2015-07-09 15:12:05	android
619116974883389440	realDonaldTrump	"@DavidBougs: @krauthammer Krauthammer sold some books, now "His Pomposity" thinks he knows US Pres politics....just another DC insider!"	2015-07-09 15:12:44	android
619117653760847872	realDonaldTrump	"@KBrocking: @realDonaldTrump @krauthammer The Donald is the only good Republican candidate, in my opinion. Rubio, Perry, etc??? Um, no."	2015-07-09 15:15:25	android
619117783465463808	realDonaldTrump	"@bdevil89: @krauthammer &amp; rest of pundits r scared of truth teller like @realDonaldTrump - #immigration affects everything in society.	2015-07-09 15:15:56	android
619117890491518977	realDonaldTrump	"@RossMahan1952: @realDonaldTrump @krauthammer Like Harry Truman, you tell them the truth and they think it's hell. Give em hell Donald"	2015-07-09 15:16:22	android
732783552513880064	realDonaldTrump	"@ShoneeP: @realDonaldTrump Trump for President! Bernie is a joke, knows nothing - and Hillary is yesterday's and today's nightmare"	2016-05-18 07:03:08	android
732788306237345794	realDonaldTrump	Paul Begala, the dopey @CNN flunky and head of the Pro-Hillary Clinton Super PAC, has knowingly committed fraud in his first ad against me.	2016-05-18 07:22:01	android
732893573365010432	realDonaldTrump	Bernie Sanders is being treated very badly by the Democrats - the system is rigged against him. Many of his disenfranchised fans are for me!	2016-05-18 14:20:19	android
732969511691816960	PressSec	RT @USDOL: How does our new #OTrule work? Your questions answered: https://t.co/yXfrwsJNyy	2016-05-18 19:22:04	<a href="http://twitter.com" rel="nofollow">Twitter Web Client</a>
732973805354819586	realDonaldTrump	Why did Clinton supporter @AlisonForKY declare Crooked Hillary winner in KY when AP hasn't even called the race?	2016-05-18 19:39:07	<a href="http://twitter.com" rel="nofollow">Twitter Web Client</a>
732988705531650048	realDonaldTrump	Thank you Arizona! See you soon! #MakeAmericaGreatAgain https://t.co/IC3pe5lRAS	2016-05-18 20:38:20	iphone
732990965426888705	realDonaldTrump	Thank you Louisiana! #Trump2016 https://t.co/u8hhrRRFMp	2016-05-18 20:47:19	iphone
733073344661061632	realDonaldTrump	#MakeAmericaGreatAgain #Trump2016 https://t.co/kXhc2j94YF https://t.co/YZAdAndKXv	2016-05-19 02:14:39	iphone
733096532149436416	realDonaldTrump	I will be interviewed by @SeanHannity tonight at 10pmE on @FoxNews. Enjoy! #MakeAmericaGreatAgain #Trump2016 https://t.co/kJw8oifgLk	2016-05-19 03:46:48	iphone
733113480207798272	realDonaldTrump	Some low-life journalist claims that I "made a pass" at her 29 years ago. Never happened! Like the @nytimes story which has become a joke!	2016-05-19 04:54:08	android
733128160603168768	realDonaldTrump	My list of potential U.S. Supreme Court Justices was very well recieved. During the next number of weeks I may be adding to the list!	2016-05-19 05:52:29	android
721987186732703744	realDonaldTrump	"@DiamondandSilk: .@realDonaldTrump is who we need 2 fix this corrupted, rigged system. 4 no Profit, Under budget &amp; ahead of schedule.	2016-04-18 12:02:13	android
722016321119121409	realDonaldTrump	Lyin' Ted Cruz can't win with the voters so he has to sell himself to the bosses-I am millions of VOTES ahead! Hillary would destroy him &amp; K	2016-04-18 13:58:00	android
722017428520243201	realDonaldTrump	Kasich only looks O.K. in polls against Hillary because nobody views him as a threat and therefore have placed ZERO negative ads against him	2016-04-18 14:02:24	android
722120138057740288	realDonaldTrump	New York, we will make America great again! https://t.co/KyxbaW4fsL	2016-04-18 20:50:31	<a href="http://instagram.com" rel="nofollow">Instagram</a>
830643095150657536	realDonaldTrump	#ICYMI: Joint Statement with Prime Minister Shinzo Abe on North Korea. https://t.co/qEC87FKB1D	2017-02-12 07:02:01	iphone
830741932099960834	realDonaldTrump	The crackdown on illegal criminals is merely the keeping of my campaign promise. Gang members, drug dealers &amp; others are being removed!	2017-02-12 13:34:45	android
830747067379232769	realDonaldTrump	72% of refugees admitted into U.S. (2/3 -2/11) during COURT BREAKDOWN are from 7 countries: SYRIA, IRAQ, SOMALIA, IRAN, SUDAN, LIBYA &amp; YEMEN	2017-02-12 13:55:10	android
830751875578355713	realDonaldTrump	While on FAKE NEWS @CNN, Bernie Sanders was cut off for using the term fake news to describe the network. They said technical difficulties!	2017-02-12 14:14:16	android
830764596235485188	realDonaldTrump	After two days of very productive talks, Prime Minister Abe is heading back to Japan. L	2017-02-12 15:04:49	android
830769247185952772	realDonaldTrump	I know Mark Cuban well. He backed me big-time but I wasn't interested in taking all of his calls.He's not smart enough to run for president!	2017-02-12 15:23:18	android
830804130692268032	realDonaldTrump	Congratulations Stephen Miller- on representing me this morning on the various Sunday morning shows. Great job!	2017-02-12 17:41:55	iphone
830857243281223681	PressSec	RT @realDonaldTrump: Congratulations Stephen Miller- on representing me this morning on the various Sunday morning shows. Great job!	2017-02-12 21:12:58	iphone
830904083519242241	realDonaldTrump	Just leaving Florida. Big crowds of enthusiastic supporters lining the road that the FAKE NEWS media refuses to mention. Very dishonest!	2017-02-13 00:19:05	android
767679356466520064	realDonaldTrump	"@realbill2016: @realDonaldTrump @Brainykid2010 @shl Trump leading LA Times poll https://t.co/908uLXCIWz"	2016-08-22 14:06:36	android
767683204039974912	realDonaldTrump	Tried watching low-rated @Morning_Joe this morning,  unwatchable! @morningmika is off the wall, a neurotic and not very bright mess!	2016-08-22 14:21:53	android
767685048703279104	realDonaldTrump	Some day, when things calm down, I'll tell the real story of @JoeNBC and his very insecure long-time girlfriend, @morningmika. Two clowns!	2016-08-22 14:29:13	android
767700760113086465	realDonaldTrump	Will be interviewed on @foxandfriends at 8:30 A.M. Eastern. ENJOY!	2016-08-22 15:31:39	android
767706807619969025	realDonaldTrump	Statement on Clinton Foundation: https://t.co/2twuzrB9om	2016-08-22 15:55:40	iphone
767830376735735808	realDonaldTrump	Great meeting with active &amp; retired law enforcement officers- at the Fraternal Order of Police lodge in Akron, Ohio. https://t.co/EUWhDC644R	2016-08-23 00:06:42	iphone
767870642716831744	realDonaldTrump	Just leaving Akron, Ohio, after a packed rally. Amazing people! Going now to Texas.	2016-08-23 02:46:42	android
767888297125355521	realDonaldTrump	.@AnnCoulter's new book, 'In Trump We Trust, comes out tomorrow. People are saying it's terrific - knowing Ann I am sure it is!	2016-08-23 03:56:51	iphone
767889674530594816	realDonaldTrump	The @WashingtonPost quickly put together a hit job book on me- comprised of copies of some of their inaccurate stories. Don't buy, boring!	2016-08-23 04:02:19	iphone
822421390125043713	realDonaldTrump	It all begins today! I will see you at 11:00 A.M. for the swearing-in. THE MOVEMENT CONTINUES - THE WORK BEGINS!	2017-01-20 14:31:53	android
778912230633005056	realDonaldTrump	Will be on @foxandfriends now.	2016-09-22 14:02:01	android
778968533749338112	realDonaldTrump	Join me in Roanoke, Virginia on Saturday evening at 6pm! #MAGA https://t.co/uKG55Pznwu	2016-09-22 17:45:45	iphone
779127602988650498	realDonaldTrump	This is more than a campaign- it is a movement. #MakeAmericaGreatAgain SIGN UP TODAY &amp; WE WILL WIN! https://t.co/2XBs5SSRC3	2016-09-23 04:17:50	iphone
779127930970599425	realDonaldTrump	I will be interviewed from Cleveland, Ohio, on @seanhannity - Tonight at 10:00 P.M. Enjoy!	2016-09-23 04:19:08	iphone
779140534753435648	realDonaldTrump	Spoke with Governor @PatMcCroryNC of North Carolina today. He is doing a tremendous job under tough circumstances.	2016-09-23 05:09:13	iphone
627487235991031808	realDonaldTrump	Watch my interview with @ericbolling on @FoxNews today at 11:30AM ET	2015-08-01 17:33:09	iphone
627526914169806849	realDonaldTrump	RT @FoxNews: .@ericbolling: "Polls show [@realDonaldTrump would] be the GOP nominee if the vote was held today." http://t.co/eXMnTvrtWD	2015-08-01 20:10:49	iphone
627528186209935361	realDonaldTrump	RT @ericbolling: @realDonaldTrump "We have to #WakeUpAmerica and build up our military"  Cashinin @FoxNews	2015-08-01 20:15:53	iphone
627528264190414848	realDonaldTrump	RT @ericbolling: @realDonaldTrump on Healthcare.. "repeal and replace Obamacare".. Cashinin now @FoxNews	2015-08-01 20:16:11	iphone
638636749103738880	realDonaldTrump	"@socalmike_SD: #Trump2016 @realdonaldtrump unofficial fight song http://t.co/Qt9rEY4qoM via @youtube" Such hard work and imagination-thanks	2015-09-01 11:57:20	android
638643793521176576	realDonaldTrump	"@highwayhopper66: @ConnieMackIV @00patriot My wife and I are both voting for trump in florida over our previous governor PERIOD!" Thank you	2015-09-01 12:25:20	android
638647394020757504	realDonaldTrump	The just released Public Policy Polling (PPP - national result) is the best yet. MAKE AMERICA GREAT AGAIN!	2015-09-01 12:39:38	android
638647705833705472	realDonaldTrump	"@BelAirCA: Only Trump is capable of cleaning up the mess America is in, that's why he has my vote! #MakeAmericaGreatAgain #Trump   So true!	2015-09-01 12:40:53	android
638742241989820416	realDonaldTrump	Yet another weak hit by a candidate with a failing campaign. Will Jeb sink as low in the polls as the others who have gone after me?	2015-09-01 18:56:32	<a href="http://twitter.com" rel="nofollow">Twitter Web Client</a>
678242598448943104	realDonaldTrump	See, Sanders backed Hillary on E-mails at the debate, hurting himself, and then she threw him under the bus (but failed). Disloyal person!	2015-12-19 17:56:51	android
678295001391087616	realDonaldTrump	President Obama spends so much time speaking of the so-called Carbon footprint, and yet he flies all the way to Hawaii on a massive old 747.	2015-12-19 21:25:05	android
678341077364011008	realDonaldTrump	Thank you Cedar Rapids, Iowa! #MakeAmericaGreatAgain https://t.co/0llSs8U77Q https://t.co/dlpd0EkR45	2015-12-20 00:28:10	iphone
678355010703515648	realDonaldTrump	Thank you America! @FoxNews post-debate poll with +/- from previous poll. #VoteTrump2016 #MakeAmericaGreatAgain https://t.co/KorKlSr01P	2015-12-20 01:23:32	iphone
678360822406606848	realDonaldTrump	#MakeAmericaGreatAgain #Trump2016 https://t.co/7FkgBAqF4A	2015-12-20 01:46:38	iphone
678420732343427072	realDonaldTrump	.@GStephanopoulos stupidly believes that Hillary wants to run against me because she said so. She says that so people believe it - opposite!	2015-12-20 05:44:41	android
784609194234306560	realDonaldTrump	Here is my statement. https://t.co/WAZiGoQqMQ	2016-10-08 07:19:43	iphone
784767399442653184	realDonaldTrump	Certainly has been an interesting 24 hours!	2016-10-08 17:48:22	android
784840992734064641	realDonaldTrump	The media and establishment want me out of the race so badly -  I WILL NEVER DROP OUT OF THE RACE, WILL NEVER LET MY SUPPORTERS DOWN! #MAGA	2016-10-08 22:40:48	android
784886214931390465	realDonaldTrump	RT @atensnut: How many times must it be said? Actions speak louder than words. DT said bad things!HRC threatened me after BC raped me.	2016-10-09 01:40:30	iphone
784886380237316098	realDonaldTrump	RT @atensnut: Hillary calls Trump's remarks "horrific" while she lives with and protects a "Rapist".  Her actions are horrific.	2016-10-09 01:41:10	iphone
784916001783709696	realDonaldTrump	Thank you to my great supporters in Wisconsin. I heard that the crowd and enthusiasm was unreal!	2016-10-09 03:38:52	android
636128157788192768	realDonaldTrump	In a clumsy move to get out of his "anchor babies" dilemma, where he signed that he would not use the term and now uses it, he blamed ASIANS	2015-08-25 13:49:06	android
636129007164108800	realDonaldTrump	Asians are very offended that JEB said that anchor babies applies to them as a way to be more politically correct to hispanics. A mess!	2015-08-25 13:52:28	android
636155822326829056	realDonaldTrump	Jeb Bush just talked about my border proposal to build a "fence." It's not a fence, Jeb, it's a WALL, and there's a BIG difference!	2015-08-25 15:39:01	android
636158507318943744	realDonaldTrump	.@GovernorPataki did a terrible job as Governor of New York. If he ran again, he would have lost in a landslide. He and Graham ZERO in polls	2015-08-25 15:49:42	android
636159580549066756	realDonaldTrump	"@ibemoshing: No hope for Jeb Bush anymore, @realDonaldTrump has been on fire! Really hope he can get the win and fix this country!	2015-08-25 15:53:57	android
636159720731090944	realDonaldTrump	"@Dlund22226523: Gov. Scott Walker has ran Wisconsin's economy into the ground. How dare he criticize you. You would fire him in a second."	2015-08-25 15:54:31	android
636160321858707456	realDonaldTrump	"@RageFelix:  @GovernorPataki ... I LIVED IN NY WHEN "TACKY PATAKI" WAS GOV... HE WAS A TOTAL DISASTER FOR THE PEOPLE OF NEW YORK	2015-08-25 15:56:54	android
636160656673255424	realDonaldTrump	"@ASA_Patriot: @realDonaldTrump @PatrickStinard @megynkelly I could not agree more ! I now flip to other channels at 9:00pm"	2015-08-25 15:58:14	android
636160908474060800	realDonaldTrump	"@linda_lcarson: @realDonaldTrump Rubio and Bush cant say Wall. I guess it is not pc. Just like obama cant say islamic terrorists !!	2015-08-25 15:59:14	android
647451082004824064	realDonaldTrump	RT @daveweigel: Packed #VVS15 ballroom for @realDonaldTrump. Biggest, classiest crowd so far http://t.co/cTcnvhlrc2	2015-09-25 19:42:21	<a href="http://twitter.com" rel="nofollow">Twitter Web Client</a>
647457058468589568	realDonaldTrump	Great reception in D.C. At the Values Voter Summit. Now checking on my job at the Old Post Office...	2015-09-25 20:06:06	iphone
647457226744070144	realDonaldTrump	.....Ahead of schedule and under budget! Will be in Oklahoma tonight!	2015-09-25 20:06:46	iphone
647473172988755968	realDonaldTrump	I am now inspecting the Old Post Office on Pennsylvania Avenue - will be a great hotel. Soon off to the Oklahoma State Fair!	2015-09-25 21:10:08	android
647479763280527360	realDonaldTrump	At the Old Post Office- http://t.co/8Rs1fbcAIz	2015-09-25 21:36:19	iphone
647483602058481664	realDonaldTrump	Dishonest @politico just called to say that none of the polls including Fox, NBC, CNN, Zogby, &amp; Morning Consult matter. Serious haters.	2015-09-25 21:51:35	iphone
647490499423674368	realDonaldTrump	.@MarcoRubio is weak on illegal immigration and will allow anyone into the country.....	2015-09-25 22:18:59	iphone
647490626406191104	realDonaldTrump	.....Has worst attendance record in Senate- rarely there to vote on a bill! @marcorubio	2015-09-25 22:19:29	iphone
647494931553107969	realDonaldTrump	.@TheHill- Trump on Boehner resignation: 'It's a good thing' http://t.co/flB93n4FoK	2015-09-25 22:36:36	<a href="http://twitter.com" rel="nofollow">Twitter Web Client</a>
647506516682100736	realDonaldTrump	RT @sethweathers: New Poll: @realDonaldTrump maintains huge lead (31%) in Georgia! #Trump2016 https://t.co/Jnam4uvKvA	2015-09-25 23:22:38	<a href="http://twitter.com" rel="nofollow">Twitter Web Client</a>
647510242679488512	realDonaldTrump	.@THR "The Donald Trump Ratings Bump: Who's Benefiting Most?" http://t.co/uNdO1kRfus	2015-09-25 23:37:26	<a href="http://twitter.com" rel="nofollow">Twitter Web Client</a>
647541233137647616	realDonaldTrump	I will be on @cbs @60minutes this Sunday. A great honor-- hope you enjoy it.	2015-09-26 01:40:35	iphone
647573199627141120	realDonaldTrump	Thank you @FrankLuntz  https://t.co/gpJBNXKV3e	2015-09-26 03:47:36	iphone
647573288970006528	realDonaldTrump	Just left Oklahoma--- the most amazing crowd and people! What a night!	2015-09-26 03:47:58	iphone
647587516934148096	realDonaldTrump	RT @TheBrodyFile: Video Exclusive: @realDonaldTrump To @TheBrodyFile : "I Am A Praying Guy" http://t.co/RsXFJZEbJG #VVS15 #2016election	2015-09-26 04:44:30	iphone
761892829434183684	realDonaldTrump	Hillary Clinton is being badly criticized for her poor performance in answering questions. Let us all see what happens!	2016-08-06 14:53:00	android
761931010548305920	realDonaldTrump	Crooked Hillary said loudly, and for the world to see, that she "SHORT CIRCUITED" when answering a question on her e-mails. Very dangerous!	2016-08-06 17:24:43	android
761936929902452740	realDonaldTrump	Anybody whose mind "SHORT CIRCUITS" is not fit to be our president! Look up the word "BRAINWASHED."	2016-08-06 17:48:14	android
761988164382756864	realDonaldTrump	Heading to New Hampshire - will be talking about Hillary saying her brain SHORT CIRCUITED, and other things!	2016-08-06 21:11:50	android
762016426102296576	realDonaldTrump	#CrookedHillary is not fit to be our next president! #TrumpPence16  https://t.co/I0zJO2sZKk	2016-08-06 23:04:08	iphone
762104411707568128	realDonaldTrump	I am not just running against Crooked Hillary Clinton, I am running against the very dishonest and totally biased media - but I will win!	2016-08-07 04:53:45	android
762106904436961280	realDonaldTrump	.@Larry_Kudlow - 'Donald Trump Is the middle-class growth candidate' https://t.co/YbqkhWNm0g	2016-08-07 05:03:39	iphone
762110918721310721	realDonaldTrump	Thank you Windham, New Hampshire! #TrumpPence16 #MAGA https://t.co/ZL4Q01Q49s	2016-08-07 05:19:37	iphone
816619023135834112	realDonaldTrump	Julian Assuage said "a 14 year old could have hacked Podesta" - why was DNC so careless? Also said it was not the Russians who gave info!	2017-01-04 14:15:21	android
816620855958601730	realDonaldTrump	Julian Assange said "a 14 year old could have hacked Podesta" - why was DNC so careless? Also said Russians did not give him the info!	2017-01-04 14:22:38	android
773113752271060992	realDonaldTrump	The truly great Phyllis Schlafly, who honored me with her strong endorsement for president, has passed away at 92. She was very special!	2016-09-06 14:00:56	android
773116580733587456	realDonaldTrump	China wouldn't provide a red carpet stairway from Air Force One and then Philippines President calls Obama "the son of a whore." Terrible!	2016-09-06 14:12:11	android
773139360824848384	realDonaldTrump	As a tribute to the late, great Phillies Schlafly, I hope everybody can go out and get her latest book, THE CONSERVATIVE CASE FOR TRUMP.	2016-09-06 15:42:42	android
773140702972801024	realDonaldTrump	As a tribute to the late, great Phyllis Schlafly, I hope everybody can go out and get her latest book, THE CONSERVATIVE CASE FOR TRUMP.	2016-09-06 15:48:02	iphone
773140953133641729	realDonaldTrump	Thank you! #AmericaFirst https://t.co/6v4C8ykDVl	2016-09-06 15:49:02	iphone
773145023319867392	realDonaldTrump	"@Ler: Message for undecided voters: Please wake up and vote DonaldTrump now! Trump/Pence very important save our America before too late!"	2016-09-06 16:05:12	android
686927355844116480	realDonaldTrump	THANK YOU! #Trump2016 https://t.co/QmDcCKppEu	2016-01-12 17:06:58	iphone
686996181268983810	realDonaldTrump	On my way to Cedar Falls, Iowa, now. Will be great--I love the people of Iowa!	2016-01-12 21:40:28	<a href="http://twitter.com" rel="nofollow">Twitter Web Client</a>
687008301356322817	realDonaldTrump	Such a serious problem for Ted &amp; the GOP. Great doubt, Dems will sue! Let's all work together to solve this problem. https://t.co/cNl6dmFb6q	2016-01-12 22:28:37	iphone
687027364933550080	realDonaldTrump	Another new Iowa poll just released. Thank you! #IACaucus #FITN https://t.co/RGkrruqpM7	2016-01-12 23:44:22	iphone
633648309203279872	realDonaldTrump	RT @Morning_Joe: Poll: @realDonaldTrump, @JebBush @RealBenCarson at the top http://t.co/kYCuOdO00Z http://t.co/IpiFPtNByS	2015-08-18 17:35:04	<a href="http://twitter.com" rel="nofollow">Twitter Web Client</a>
633658260776714240	realDonaldTrump	It does matter! https://t.co/SDfmHgneAf	2015-08-18 18:14:36	<a href="http://twitter.com" rel="nofollow">Twitter Web Client</a>
633692600042680320	realDonaldTrump	RT @foxandfriends: .@realDonaldTrump takes aim at Hillary Clinton in new video just released on Instagram https://t.co/ZiFyTPpIni	2015-08-18 20:31:03	<a href="http://twitter.com" rel="nofollow">Twitter Web Client</a>
644928682038009856	realDonaldTrump	RT @kingsthings: Just got back from Italy and let me tell you, they are just as fascinated by @realDonaldTrump as everyone else is.	2015-09-18 20:39:14	<a href="http://twitter.com" rel="nofollow">Twitter Web Client</a>
701033104605999104	realDonaldTrump	"@dnmiller2000: @realDonaldTrump I'm a Regan Dem and believe in your message! God bless you and your campaign!"	2016-02-20 15:18:11	android
701033286223572992	realDonaldTrump	"@rwalkerTennesse: #SouthCarolina If you want a job next January @Vote_For_Trump today. @realDonaldTrump will work for the people."	2016-02-20 15:18:54	android
701043432354095108	realDonaldTrump	Lying #Ted Cruz just (on election day) came out with a sneak and sleazy Robocall. He holds up the Bible but in fact is a true lowlife pol!	2016-02-20 15:59:13	android
711414965224259586	realDonaldTrump	"@jojo2foxy: TRUMP IS NOT AFRAID OF ANYTHING OR ANYONE - THAT'S THE PRESIDENT USA NEEDS TO UNITE US &amp; KNOCK THE SOCKS OFF OUR ENEMIES!	2016-03-20 06:51:59	android
711418254556852224	realDonaldTrump	The rallies in Utah and Arizona were great! Tremendous crowds and spirit. Just returned but will be going back soon.	2016-03-20 07:05:04	android
654965652466348032	realDonaldTrump	.@CNBC has just agreed that the debate will be TWO HOURS. Fantastic news for all, especially the millions of people who will be watching!	2015-10-16 13:22:34	android
654986743989600256	realDonaldTrump	.@EricTrump was FANTASTIC on @foxandfriends this morning. He may be my son but he is a special guy!	2015-10-16 14:46:23	android
654987789705048064	realDonaldTrump	"@JoeyL3rd: @foxandfriends @EricTrump Grt interview, I'm telling ya, @realDonaldTrump children r going 2 b a HUGE asset 2 him &amp; his campaign	2015-10-16 14:50:32	android
654988631694823424	realDonaldTrump	"@SHLOMO_ABADDON: @TODAYshow @MLauer @realDonaldTrump Matt will vote for Trump i just know he will !"	2015-10-16 14:53:53	android
654988659410739200	realDonaldTrump	"@Pjdahling: @mitchellvii the truth prevails when it is so obvious. @realDonaldTrump is a force that is unstoppable"	2015-10-16 14:54:00	android
