623136587241664512	realDonaldTrump	The ever dwindling @WSJ which is worth about 1/10 of what it was purchased for, is always hitting me politically. Who cares!	2015-07-20 17:25:14	<a href="http://twitter.com" rel="nofollow">Twitter Web Client</a>
623136748718137344	realDonaldTrump	We will soon be at a point with our incompetent politicians where we will be treating illegal immigrants better than our veterans.	2015-07-20 17:25:52	<a href="http://twitter.com" rel="nofollow">Twitter Web Client</a>
623148027579113472	realDonaldTrump	" @johnjcarp61  At least we're talking about the #VA! We weren't a month ago! @realDonaldTrump @JohnMcCain"	2015-07-20 18:10:41	<a href="http://twitter.com" rel="nofollow">Twitter Web Client</a>
623150946282029056	realDonaldTrump	"@VetApologist This is big criticism of the Republican field. Speak truth and stop being so PC. This is why @realDonaldTrump resonates!"	2015-07-20 18:22:17	<a href="http://twitter.com" rel="nofollow">Twitter Web Client</a>
623151595333779456	realDonaldTrump	"@DanScavino @realDonaldTrump hosts events around the #USA 4our #Veterans. Long before a presidential run. He loves our military."	2015-07-20 18:24:52	<a href="http://twitter.com" rel="nofollow">Twitter Web Client</a>
623156424823193600	realDonaldTrump	"@_EOD 2m2 minutes ago I believe we have passed that point. There are Homeless Veterans in USA &amp; yet Illegal Aliens get Government Housing"	2015-07-20 18:44:04	<a href="http://twitter.com" rel="nofollow">Twitter Web Client</a>
623156677769056256	realDonaldTrump	"@_EOD  I believe we have passed that point. There are Homeless Veterans in USA &amp; yet Illegal Aliens get Government Housing"	2015-07-20 18:45:04	<a href="http://twitter.com" rel="nofollow">Twitter Web Client</a>
623157718086500353	realDonaldTrump	"@amit_amit24 @realdonaldtrump I agree 100%. McCain is fighting for illigal immigrant but never did anything for our Vets."	2015-07-20 18:49:12	<a href="http://twitter.com" rel="nofollow">Twitter Web Client</a>
623158383768682498	realDonaldTrump	"@RTMatador Trump says things that no one else would even consider saying, I agree with him on the immigration situation, i love honesty"	2015-07-20 18:51:51	<a href="http://twitter.com" rel="nofollow">Twitter Web Client</a>
623158804738387968	realDonaldTrump	"@MJJustus1 @AndrewStilesUSA @realDonaldTrump Trump already hosts vets at his resorts. What does Hillary do?"	2015-07-20 18:53:31	<a href="http://twitter.com" rel="nofollow">Twitter Web Client</a>
623159198956810241	realDonaldTrump	"@Valenti317 @realDonaldTrump the left is petrified of you! Why else would they be attacking you so vigorously?"	2015-07-20 18:55:05	<a href="http://twitter.com" rel="nofollow">Twitter Web Client</a>
623164663023423488	realDonaldTrump	"@LinFlies @GhostDancer_2 @contrarian11 @MichaelCohen212 @ChrisCuomo @DeptVetAffairs ...rest of GOP only cries but Trump gets stuff DONE"	2015-07-20 19:16:48	<a href="http://twitter.com" rel="nofollow">Twitter Web Client</a>
738598954468659200	realDonaldTrump	"@Crz4basball: @JudgeJeanine  @realDonaldTrump Looks like several legal Hispanics supporting Trump! They know he will be good for them too."	2016-06-03 08:11:27	android
738599744759431168	realDonaldTrump	"@angeloftruth11: Clinton says Trump is dangerous. Who's the one who killed 4 Americans in Benghazi?  https://t.co/ZV5ehm6NKR"	2016-06-03 08:14:36	android
738600538976096256	realDonaldTrump	"@LunsfordWhitney: This is rich coming from her. She tweeted you will be president! #Women4Ttump #Trump2016 https://t.co/2GSGfLS1yT"	2016-06-03 08:17:45	android
738601935771570180	realDonaldTrump	"@LiliannyLeebou: I think the first female president of the USA will be @IvankaTrump a beautiful intelligent young genuine successful lady!"	2016-06-03 08:23:18	android
738602229100224513	realDonaldTrump	"@fivestarr6028: Yes! Hubby and I voted 4 @realDonaldTrump already! https://t.co/h1iHiJNUjm" Thank you.	2016-06-03 08:24:28	android
738711092252155904	realDonaldTrump	Terrible jobs report just reported. Only 38,000 jobs added. Bombshell!	2016-06-03 15:37:03	android
738712803775631361	realDonaldTrump	Rally last night in San Jose was great. Tremendous love and enthusiasm in the hall. Big crowd. Outside, small group of thugs burned Am flag!	2016-06-03 15:43:51	android
738718346045063168	realDonaldTrump	I don't watch or do @Morning_Joe anymore. Small audience, low ratings! I hear Mika has gone wild with hate. Joe is Joe. They lost their way!	2016-06-03 16:05:53	android
738720347239809024	realDonaldTrump	In Crooked Hillary's telepromter speech yesterday, she made up things that I said or believe but have no basis in fact. Not honest!	2016-06-03 16:13:50	android
738762615334174720	realDonaldTrump	"I'm a former chief of police in a border town. I'm Hispanic, I'm proud to be Hispanic and I'm 100% behind Trump." https://t.co/8YtBU7j17m	2016-06-03 19:01:47	iphone
738808292550397953	realDonaldTrump	So much interest in my visit to Scotland! I greatly look forward to attending the opening event @TrumpTurnberry- taking place on June 24th.	2016-06-03 22:03:17	iphone
738809335841595392	realDonaldTrump	Great evening in San Jose other than the thugs. My supporters are far tougher if they want to be, but fortunately they are not hostile.	2016-06-03 22:07:26	iphone
738858013419835392	realDonaldTrump	Thank you Redding, California! #MakeAmericaGreatAgain #CAPrimary https://t.co/nFiydpTpPn	2016-06-04 01:20:52	iphone
738901792210194432	realDonaldTrump	RT @CBSNews: WATCH NOW: The @realDonaldTrump supporters you'd never expect https://t.co/jKeVJX5u73 https://t.co/pbft0Eq3Y1	2016-06-04 04:14:50	iphone
783660227530862592	realDonaldTrump	The constant interruptions last night by Tim Kaine should not have been allowed. Mike Pence won big!	2016-10-05 16:28:52	android
783738595987169280	realDonaldTrump	Beautiful morning- thank you @ICLV! https://t.co/xzJhrLgjHP	2016-10-05 21:40:17	iphone
749659173353299968	realDonaldTrump	Just watched @meetthepress and how totally biased against me Chuck Todd, and the entire show, is against me.The good news-the people get it!	2016-07-03 20:40:49	android
749698321074180096	realDonaldTrump	Only a fool would believe that the meeting between Bill Clinton and the U.S.A.G. was not arranged or that Crooked Hillary did not know.	2016-07-03 23:16:23	android
749699315367612416	realDonaldTrump	Crooked Hillary Clinton knew that her husband wanted to meet with the U.S.A.G. to work out a deal. The system is totally rigged &amp; corrupt!	2016-07-03 23:20:20	android
749706242579247105	realDonaldTrump	On Saturday a great man, Elie Wiesel, passed away.The world is a better place because of him and his belief that good can triumph over evil!	2016-07-03 23:47:51	android
749709462974435329	realDonaldTrump	"THE SYSTEM IS RIGGED!"	2016-07-04 00:00:39	android
749718947973529600	realDonaldTrump	Does anybody really believe that Bill Clinton and the U.S.A.G. talked only about "grandkids" and golf for 37 minutes in plane on tarmac?	2016-07-04 00:38:20	android
749720224220475393	realDonaldTrump	The SECRET meeting between Bill Clinton and the U.S.A.G. in back of closed plane was heightened with FBI shouting "go away, no pictures."	2016-07-04 00:43:25	android
749721116911034368	realDonaldTrump	I believe that Crooked Hillary sent Bill to have the meeting with the U.S.A.G. So Bill is not in trouble with H except that he got caught!	2016-07-04 00:46:58	android
681803307929710592	realDonaldTrump	I will be interviewed on the @TODAYshow at 7:00 A.M. Talking about the state of the race for president, and more. Enjoy!	2015-12-29 13:45:50	android
681816443093159937	realDonaldTrump	"Minorities line up behind.....Donald Trump" #Trump2016 #MakeAmericaGreatAgain https://t.co/cEMKihLZbK https://t.co/SxuutW2onm	2015-12-29 14:38:02	iphone
681845591027134464	realDonaldTrump	My campaign for president is $35,000,000 under budget, I have spent very little (and am in 1st place).Now I will spend big in Iowa/N.H./S.C.	2015-12-29 16:33:51	android
681847012304797696	realDonaldTrump	So, I have spent almost nothing on my run for president and am in 1st place. Jeb Bush has spent $59 million &amp; done. Run country my way!	2015-12-29 16:39:30	android
681910074906906624	realDonaldTrump	Looking forward to being in Council Bluffs, Iowa, later today. Despite weather, rally is on -- will be fantastic! #MakeAmericaGreatAgain!	2015-12-29 20:50:05	<a href="http://twitter.com" rel="nofollow">Twitter Web Client</a>
681917663514365952	realDonaldTrump	We need a real President! https://t.co/nw7BIAW7HV	2015-12-29 21:20:15	<a href="http://twitter.com" rel="nofollow">Twitter Web Client</a>
681936877222494208	realDonaldTrump	I hope @TGowdySC does better for Rubio than he did at the #Benghazi hearings, which were a total disaster for Republicans &amp; America!	2015-12-29 22:36:35	iphone
681971453261119488	realDonaldTrump	New #ReutersPoll. Thank you America!  #MakeAmericaGreatAgain #Trump2016 https://t.co/oETsjV3aR4	2015-12-30 00:53:59	iphone
681997313925976066	realDonaldTrump	Shows how dumb Joe McQuaid (@deucecrew) of the dying Union Leader is to put out the letter I wrote saying why I didn't do his failed debate!	2015-12-30 02:36:45	iphone
681997425356095488	realDonaldTrump	The great people of New Hampshire, who I love, are not properly served by the dying Union Leader newspaper.	2015-12-30 02:37:11	iphone
681997481740087296	realDonaldTrump	Joe McQuaid (@deucecrew) of the dying Union Leader wanted ads, lunches, donations, speeches from me, and tweets---very unethical.	2015-12-30 02:37:25	iphone
682048994705584129	realDonaldTrump	THANK YOU Council Bluffs, Iowa! The silent majority, is silent no more! #Trump2016 #FITN https://t.co/VTAe68eQ1k https://t.co/IPsJPVH5JP	2015-12-30 06:02:06	iphone
828574430800539648	realDonaldTrump	Any negative polls are fake news, just like the CNN, ABC, NBC polls in the election. Sorry, people want border security and extreme vetting.	2017-02-06 14:01:53	android
828575949268606977	realDonaldTrump	I call my own shots, largely based on an accumulation of data, and everyone knows it. Some FAKE NEWS media, in order to marginalize, lies!	2017-02-06 14:07:55	android
643649653079040000	realDonaldTrump	Speech in Dallas went really well. Big and wonderful crowd. Just arrived in L.A. Big day tomorrow!	2015-09-15 07:56:50	android
643650157905494016	realDonaldTrump	"@SandraAtwood10: @risetoflyy @realDonaldTrump FABULOUS DONALD. SO PROUD OF U! KEEP UP GD WORK! @foxnews @cnn @rushlimbaugh"	2015-09-15 07:58:50	android
632541549751091200	realDonaldTrump	In the plane heading to Iowa State Fair. Will be great fun. Hopefully giving helicopter rides to some of the kids.	2015-08-15 16:17:12	android
632576383705743360	realDonaldTrump	RT @DanScavino: Just landed in #Iowa! Be sure to follow @realDonaldTrump on @periscopeco @periscopetv at airport &amp; @IowaStateFair!	2015-08-15 18:35:37	iphone
632577165029076993	realDonaldTrump	LIVE on #Periscope: Good morning Iowa! Let's #MakeAmericaGreatAgain #Trump2016  https://t.co/zSLKMCk0tW	2015-08-15 18:38:43	<a href="https://periscope.tv" rel="nofollow">Periscope.TV</a>
725535327927042048	realDonaldTrump	"@AnnetteJeanne: I cried when they said you made a clean sweep of all 5 states. I was SO HAPPY! I really adore you Mr. Trump, so much."	2016-04-28 07:01:16	android
725636069010579457	realDonaldTrump	Thank you to all for the wonderful reviews of my foreign policy speech. I will soon be speaking in great detail on numerous other topics!	2016-04-28 13:41:35	android
725637460504510464	realDonaldTrump	I will be interviewed on the @TODAYshow at 7:00 A.M. this morning. Enjoy!	2016-04-28 13:47:06	android
725647068459454464	realDonaldTrump	Lyin' Ted Cruz, who can never beat Hilary Clinton, has chosen a running mate who was unable to catch on in her own failed campaign. No path!	2016-04-28 14:25:17	android
725648706385633280	realDonaldTrump	Lyin' Ted Cruz, who can never beat Hillary Clinton and has NO path to victory, has chosen a V.P.candidate who failed badly in her own effort	2016-04-28 14:31:48	android
725659482819297280	realDonaldTrump	I will be in Evansville, Indiana, with the great Bobby Knight (who last night endorsed me) at 12:00 this afternoon. See you there!	2016-04-28 15:14:37	android
725677423195512833	realDonaldTrump	So many false and phony T.V. commercials being broadcast in Indiana. Reminds me of Florida where thousands were put up-I won in a landslide!	2016-04-28 16:25:54	android
725722027173249024	realDonaldTrump	Heading to rally with Bobby now! See you soon! https://t.co/dWSSOEctZn	2016-04-28 19:23:09	<a href="http://twitter.com" rel="nofollow">Twitter Web Client</a>
725796339255267328	realDonaldTrump	Thank you Evansville, Indiana!  #MakeAmericaGreatAgain https://t.co/Fn8ClNjUtr	2016-04-29 00:18:26	iphone
725817204743217152	realDonaldTrump	#MakeAmericaGreatAgain https://t.co/53qHBKs7yA	2016-04-29 01:41:21	iphone
725824909151199232	realDonaldTrump	#MakeAmericaGreatAgain #Trump2016 https://t.co/ZHM5w7jnss	2016-04-29 02:11:58	iphone
736410143378792448	realDonaldTrump	Obama administration fails to screen Syrian refugees' social media accounts: https://t.co/MMa07nwa44	2016-05-28 07:13:54	iphone
736441853097218048	realDonaldTrump	Great rally in Fresno, California- great crowd! Thank you! #Trump2016 https://t.co/TVSPvxOmve	2016-05-28 09:19:54	iphone
736554410361409536	realDonaldTrump	The U.S. has 69 treaties with other countries where we would have to defend them and their borders. How nice, but what do we get? NOT ENOUGH	2016-05-28 16:47:10	android
736569533738156036	realDonaldTrump	I (we) broke the all-time record for most votes gotten in a Republican Primary - by a lot - and with many states left to go! Thank you.	2016-05-28 17:47:16	android
736655375911530498	realDonaldTrump	The failing @nytimes wrote a story about my management style &amp; that I don't have many people. I have 73, Hillary has 800- &amp; I'm beating her.	2016-05-28 23:28:22	iphone
736655448993107968	realDonaldTrump	The media is on a new phony kick about my management style. I spend much less money &amp; get much better results! What we need as Prez!	2016-05-28 23:28:40	iphone
736655485814857728	realDonaldTrump	I am always on the front page of the failing @nytimes, but when I won the GOP nomination, I'm in the back of the paper. Very dishonest!	2016-05-28 23:28:48	iphone
736671884247478272	realDonaldTrump	Don't believe the biased and phony media quoting people who work for my campaign. The only quote that matters is a quote from me!	2016-05-29 00:33:58	iphone
736672123012427776	realDonaldTrump	Does President Obama ever discuss the sneak attack on Pearl Harbor while he's in Japan? Thousands of American lives lost. #MDW	2016-05-29 00:34:55	iphone
638297160992358400	realDonaldTrump	Loved being with my many friends in Tennessee. The crowd and enthusiasm was fantastic. I won the straw poll big!	2015-08-31 13:27:56	android
638298477441732608	realDonaldTrump	Leading in the Bloomberg Iowa poll. Also, my favorability numbers went up at a record, almost unheard of, clip. Thank you Iowa!	2015-08-31 13:33:10	android
638306323487195136	realDonaldTrump	"@nodramahea: @realDonaldTrump Gaining more supporters every day. People want change. Trump2016"	2015-08-31 14:04:21	android
638318502059880450	realDonaldTrump	Huma Abedin, the top aide to Hillary Clinton and the wife of perv sleazebag Anthony Wiener, was a major security risk as a collector of info	2015-08-31 14:52:44	android
818841421364989952	realDonaldTrump	'U.S. Small-Business Optimism Index Surges by Most Since 1980' https://t.co/X22x1BttdG	2017-01-10 17:26:22	iphone
818922995980845056	realDonaldTrump	'Small business optimism soars after Trump election' https://t.co/WjBaTp824U	2017-01-10 22:50:31	iphone
818948254943604736	realDonaldTrump	'Trump Helps Lift Small Business Confidence to 12-Yr. High' https://t.co/MhbABREhzt https://t.co/CWAvJ4fRdx	2017-01-11 00:30:53	iphone
818990655418617856	realDonaldTrump	FAKE NEWS - A TOTAL POLITICAL WITCH HUNT!	2017-01-11 03:19:23	android
818994757569564673	realDonaldTrump	RT @MichaelCohen212: I have never been to Prague in my life. #fakenews https://t.co/CMil9Rha3D	2017-01-11 03:35:41	iphone
819000924207251456	realDonaldTrump	'BuzzFeed Runs Unverifiable Trump-Russia Claims' #FakeNews  https://t.co/d6daCFZHNh	2017-01-11 04:00:11	iphone
707470040954761216	realDonaldTrump	Thank you Hawaii! #Trump2016	2016-03-09 09:36:16	iphone
707656262411001857	realDonaldTrump	Phony Club For Growth tried to shake me down for one millions dollars, and is now putting out nasty negative ads on me.They are total losers	2016-03-09 21:56:15	android
707683931609550848	realDonaldTrump	Phony Club For Growth tried to shake me down for one million dollars, &amp; is now putting out nasty negative ads on me. They are total losers!	2016-03-09 23:46:12	iphone
707697346646245376	realDonaldTrump	Keep lightweight Marco and his friends out of the White House.  #MakeAmericaGreatAgain #Trump2016 https://t.co/hNkkRx66Hc	2016-03-10 00:39:30	iphone
707702633260261377	realDonaldTrump	Another Dishonest Politician  #LightweightSenatorMarcoRubio https://t.co/w7G5vJ511O	2016-03-10 01:00:30	iphone
707722045224833024	realDonaldTrump	I will be giving a lengthy interview to @andersoncooper tonight at 8pmE from Florida. Watch on @CNN! #MakeAmericaGreatAgain #Trump2016	2016-03-10 02:17:39	iphone
707722839684685824	realDonaldTrump	I will be interviewed in a town hall format on @FoxNews with @seanhannity at 10pmE. Enjoy! #MakeAmericaGreatAgain #Trump2016	2016-03-10 02:20:48	iphone
775275158340853760	realDonaldTrump	I will be interviewed on @foxandfriends at 7:00 A.M.	2016-09-12 13:09:36	android
775293160838819841	realDonaldTrump	Will be on @CNBC at @7:22. Enjoy!	2016-09-12 14:21:08	android
775350882581958657	PressSec	RT @WhiteHouse: .@POTUS makes a statement on the occasion of Eid al-Adha: https://t.co/7MxLFB6Abk	2016-09-12 18:10:30	<a href="https://about.twitter.com/products/tweetdeck" rel="nofollow">TweetDeck</a>
775361266001084416	realDonaldTrump	Stopped by @TrumpDC to thank all of the tremendous men &amp; women for their hard work! https://t.co/oGcJL4N454	2016-09-12 18:51:45	iphone
775492989175160836	realDonaldTrump	Just got back from Asheville,  North Carolina, where we had a massive rally. The spirit of the crowd was unbelievable. Thank you!  #MAGA	2016-09-13 03:35:11	android
775496470816514048	realDonaldTrump	"@brimyers813: Saw ur speech on Twitter. U give me hope and optimism. I feel as though I am in the room with u. I pray 4 ur/our success."	2016-09-13 03:49:01	android
775534440240013312	realDonaldTrump	Join me in Clive, Iowa tomorrow at noon! #AmericaFirst #MAGA Tickets: https://t.co/TEY6BbCyxt https://t.co/l17uzRPyLs	2016-09-13 06:19:53	iphone
697027290820186112	realDonaldTrump	Remember @JebBush wants COMMON CORE (education from D.C.) and is very weak on ILLEGAL IMMIGRATION ("come as act of love"). Not a leader!	2016-02-09 14:00:30	android
697029254584934400	realDonaldTrump	I know the "Governors" and Jeb Bush, who has gone nasty with lies, is by far the weakest of the lot. His family used private eminent domain!	2016-02-09 14:08:19	android
697031343272812544	realDonaldTrump	No-one has done more for people with disabilities than me. I have spent many millions of dollars to help out-and am happy to have done so!	2016-02-09 14:16:37	android
697033106608541697	realDonaldTrump	The polls are now showing that I am the best to win the GENERAL ELECTION. States that are never in play for Repubs will be won by me. Great!	2016-02-09 14:23:37	android
697038423429767169	realDonaldTrump	Will be interviewed on @Morning_Joe at 8:00 A.M. Enjoy!	2016-02-09 14:44:45	android
697050425195941888	realDonaldTrump	I will be interviewed on @foxandfriends at 8:40. A.M. Enjoy!	2016-02-09 15:32:26	android
697051619427397633	realDonaldTrump	MAKE AMERICA GREAT AGAIN!	2016-02-09 15:37:11	android
697062728582766592	realDonaldTrump	Thank you for a great night at the Verizon Wireless Arena- New Hampshire! #VoteTrumpNH #MakeAmericaGreatAgain #FITN https://t.co/pbt7gDaw7y	2016-02-09 16:21:19	iphone
697065472425123840	realDonaldTrump	A message to the great people of New Hampshire on this important day! #VoteTrumpNH  Video: https://t.co/7S2f2GSMB8 https://t.co/9WwRWnvqiv	2016-02-09 16:32:14	iphone
697077741640880129	realDonaldTrump	You can find your polling locations at:  https://t.co/BmZyKQOZJJ #FITN #NHPrimary #VoteTrumpNH https://t.co/8lREIqhIuN	2016-02-09 17:20:59	iphone
697099036013281280	realDonaldTrump	#NHPrimary  @IvankaTrump: https://t.co/rCvRB3XdTI @DonaldJTrumpJr @EricTrump: https://t.co/wAqXyhu2Pr #MakeAmericaGreatAgain #VoteTrumpNH	2016-02-09 18:45:36	iphone
697099208415903744	realDonaldTrump	New Hampshire vote today -  MAKE AMERICA GREAT AGAIN!	2016-02-09 18:46:17	android
697173206663213057	realDonaldTrump	ISIS is making big threats today - no respect for U.S.A. or our "leader" - If I win it will be a very different story,with very fast results	2016-02-09 23:40:19	android
697182075045179392	realDonaldTrump	We will immediately repeal and replace ObamaCare - and nobody can do that like me. We will save $'s and have much better healthcare!	2016-02-10 00:15:34	android
697183070357753862	realDonaldTrump	We will stop heroin and other drugs from coming into New Hampshire from our open southern border. We will build a WALL and have security.	2016-02-10 00:19:31	android
697263254083489792	realDonaldTrump	Thank you, New Hampshire! Departing with my amazing family now! #FITN #NHPrimary https://t.co/rbFfcq8gQq https://t.co/73aoZk8uMG	2016-02-10 05:38:08	iphone
697263333959995393	realDonaldTrump	Thank you to the people of  New Hampshire, I love you! Now, off to South Carolina.	2016-02-10 05:38:27	android
697276230060666881	realDonaldTrump	Thank you Mark! #NHPrimary  https://t.co/Cf56TqGaEd	2016-02-10 06:29:42	iphone
763948576351203328	realDonaldTrump	"@elsolarverde: @nytimes THE CORRUPT MEDIA CREATS CONTROVERSY AGAINST DonaldTrump TO AVOID ISSUES ABOUT  https://t.co/RW5UcWLfA8"	2016-08-12 07:01:48	android
763949723833118721	realDonaldTrump	"@elsolarverde: THE CORRUPT MEDIA CREATS CONTROVERSY AGAINST @realDonaldTrump TO AVOID ISSUES ABOUT HillaryClinton https://t.co/RW5UcWLfA8"	2016-08-12 07:06:22	android
763950742755434498	realDonaldTrump	"@EnemyWithinn: @realDonaldTrump @elsolarverde @nytimes People gotta stop believing media lies about Trump." That would indeed be nice!	2016-08-12 07:10:25	android
764045345332396032	realDonaldTrump	Ratings challenged @CNN reports so seriously that I call President Obama (and Clinton) "the founder" of ISIS, &amp; MVP. THEY DON'T GET SARCASM?	2016-08-12 13:26:20	android
764053208394182656	realDonaldTrump	"@laurencristmann: Thank you for coming to Pennsylvania today. I will be there with @C_Lynne_Ryan your 3rd CD delegate at 2 pm"	2016-08-12 13:57:34	android
764055793951834114	realDonaldTrump	A massive tax increase will be necessary to fund Crooked Hillary Clinton's agenda. What a terrible (and boring) rollout that was yesterday!	2016-08-12 14:07:51	android
764064821000056832	realDonaldTrump	I love watching these poor, pathetic people (pundits) on television working so hard and so seriously to try and figure me out. They can't!	2016-08-12 14:43:43	android
764084294704697344	realDonaldTrump	ISIS gained tremendous strength during Hillary Clinton's term as Secretary of State. When will the dishonest media report the facts!	2016-08-12 16:01:06	android
764153606765412352	realDonaldTrump	Unbelievable support in Florida last night - thank you! #MAGA https://t.co/WNDAagFRRS	2016-08-12 20:36:31	iphone
764154460264394752	realDonaldTrump	We will repeal and replace disastrous #Obamacare! #TrumpPence16 https://t.co/Lx4Gdj5zGk	2016-08-12 20:39:55	iphone
764186768522420224	realDonaldTrump	Thank you Erie, Pennsylvania! Together we will #MakeAmericaGreatAgain! https://t.co/5hZp7PnRoT	2016-08-12 22:48:18	iphone
764254551822196737	realDonaldTrump	Will be on @seanhannity tonight at 10pm, hosted by @GovMikeHuckabee. Enjoy!	2016-08-13 03:17:38	iphone
834377364947816448	realDonaldTrump	One thing I will say about Rep. Keith Ellison, in his fight to lead the DNC, is that he was the one who predicted early that I would win!	2017-02-22 14:20:40	android
834384982495940613	realDonaldTrump	Very much enjoyed my tour of the Smithsonian's National Museum of African American History and Culture...A great job done by amazing people!	2017-02-22 14:50:56	android
684719974938742785	realDonaldTrump	Will be interviewed on @foxandfriends at 8:00 A.M. Enjoy!	2016-01-06 14:55:38	android
684742583520722944	realDonaldTrump	Germany is going through massive attacks to its people  by the migrants allowed to enter the country. New Years Eve was a disaster. THINK!	2016-01-06 16:25:28	android
684751768522194944	realDonaldTrump	HAPPY BIRTHDAY to my son, @EricTrump! Very proud of you! https://t.co/ZHMKIqnUwL https://t.co/IJzW2NDJyA	2016-01-06 17:01:58	iphone
747415955400196096	realDonaldTrump	Crooked Hillary is wheeling out one of the least productive senators in the U.S. Senate, goofy Elizabeth Warren, who lied on heritage.	2016-06-27 16:07:04	android
747418754255052802	realDonaldTrump	The media is unrelenting. They will only go with and report a story in a negative light. I called Brexit (Hillary was wrong), watch November	2016-06-27 16:18:12	android
747424042181791744	realDonaldTrump	.@CNN is all negative when it comes to me. I don't watch it anymore.	2016-06-27 16:39:12	android
789487320290430976	realDonaldTrump	Huma calls it a "MESS," the rest of us call it CORRUPT! WikiLeaks catches Crooked in the act - again. #DrainTheSwamp https://t.co/juvdLIJPWu	2016-10-21 18:23:39	iphone
789520268972601344	realDonaldTrump	The results are in on the final debate and it is almost unanimous, I WON! Thank you, these are very exciting times.	2016-10-21 20:34:35	android
