845974102619906048	realDonaldTrump	Democrats are smiling in D.C. that the Freedom Caucus, with the help of Club For Growth and Heritage, have saved Planned Parenthood &amp; Ocare!	2017-03-26 15:21:58	iphone
846166053663191040	realDonaldTrump	General Kelly is doing a great job at the border. Numbers are way down. Many are not even trying to come in anymore.	2017-03-27 04:04:42	iphone
835814988686233601	realDonaldTrump	The race for DNC Chairman was, of course, totally "rigged." Bernie's guy, like Bernie himself, never had a chance. Clinton demanded Perez!	2017-02-26 13:33:16	android
835817351178301440	realDonaldTrump	For first time the failing @nytimes will take an ad (a bad one) to help save its failing reputation. Try reporting accurately &amp; fairly!	2017-02-26 13:42:39	android
835916511944523777	realDonaldTrump	Russia talk is FAKE NEWS put out by the Dems, and played up by the media, in order to mask the big election defeat and the illegal leaks!	2017-02-26 20:16:41	android
835946001873657858	realDonaldTrump	Big dinner with Governors tonight at White House. Much to be discussed, including healthcare.	2017-02-26 22:13:52	android
820251730407473153	realDonaldTrump	Congressman John Lewis should spend more time on fixing and helping his district, which is in horrible shape and falling apart (not to......	2017-01-14 14:50:26	android
820255947956383744	realDonaldTrump	mention crime infested) rather than falsely complaining about the election results. All talk, talk, talk - no action or results. Sad!	2017-01-14 15:07:12	android
820257714362314753	realDonaldTrump	INTELLIGENCE INSIDERS NOW CLAIM THE TRUMP DOSSIER IS "A COMPLETE FRAUD!"  @OANN	2017-01-14 15:14:13	android
820425770925338624	realDonaldTrump	Congressman John Lewis should finally focus on the burning and crime infested inner-cities of the U.S. I can use all the help I can get!	2017-01-15 02:22:01	android
820450166331346944	realDonaldTrump	Inauguration Day is turning out to be even bigger than expected. January 20th, Washington D.C. Have fun!	2017-01-15 03:58:57	android
776773380414537728	realDonaldTrump	I am now going to the brand new Trump International, Hotel D.C. for a major statement.	2016-09-16 16:23:00	android
765623972234948608	realDonaldTrump	Another health insurer is pulling back due to 'persistent financial losses on #Obamacare plans.' Only the beginning! https://t.co/YqfaEvg8c3	2016-08-16 21:59:14	iphone
765629939811020802	realDonaldTrump	'It's just a 2-point race, Clinton 38%, Trump 36%' https://t.co/EzDzJ4EzIN	2016-08-16 22:22:57	iphone
765679267086684161	realDonaldTrump	This is my pledge to the American people: https://t.co/Jb21oyNfxt	2016-08-17 01:38:57	iphone
765688915932045313	realDonaldTrump	Just as we won the Cold War, in part, by exposing the evils of communism and the virtues of free markets.... Cont: https://t.co/SXp7efXEZU	2016-08-17 02:17:18	iphone
765726909925851136	realDonaldTrump	Will be on @SeanHannity tonight at 10pmE - delivering an important speech live from Wisconsin. #MakeAmericaGreatAgain	2016-08-17 04:48:16	iphone
788342075582328832	realDonaldTrump	"@THEREALMOGUL: 41% of American voters believe the  election could be "stolen" from DonaldTrump due to widespread voter fraud. - Politico"	2016-10-18 14:32:52	android
788402585816276992	realDonaldTrump	I will Make Our Government Honest Again -- believe me. But first, I'm going to have to #DrainTheSwamp in DC. https://t.co/m1lMAQPnIb	2016-10-18 18:33:18	iphone
788402786970939392	realDonaldTrump	Pay-to-play. Collusion. Cover-ups. And now bribery? So CROOKED. I will #DrainTheSwamp. https://t.co/FNzMit7mD8	2016-10-18 18:34:06	iphone
788403448593002496	realDonaldTrump	If we let Crooked run the govt, history will remember 2017 as the year America lost its independence. #DrainTheSwamp https://t.co/VpYiO8CnXQ	2016-10-18 18:36:44	iphone
674560648790089728	realDonaldTrump	The failing @nytimes does not mention the new @CNN Poll that has me leading Iowa by a massive 13 points - I am at 33%. Maggie Haberman, sad!	2015-12-09 14:06:06	android
674577809877147648	realDonaldTrump	The last person corrupt Hillary Clinton wants to run against is Donald J. Trump. I'll end up beating her in every state. New Fox Poll-Trump!	2015-12-09 15:14:17	android
674578580681134080	realDonaldTrump	Hillary Clinton does not have the STRENGTH or STAMINA to be President. We need strong and super smart for our next leader - or trouble!	2015-12-09 15:17:21	android
674578805906931712	realDonaldTrump	"@ray_aub:  @nytimes @CNN People forget the policies of leaders like @JebBush allowed 9/11 killers to immigrate, drive, &amp; pilot planes"	2015-12-09 15:18:15	android
674578928741257216	realDonaldTrump	"@ssheaver: @realDonaldTrump @nytimes @CNN https://t.co/QrsEZy8U3e" Wow!	2015-12-09 15:18:44	android
674579252956815360	realDonaldTrump	"@mysteriousLoser: @realDonaldTrump did you hear the mayor nutter of philadelphias comments towards you? Ignorance" Yes, he is a crude dope!	2015-12-09 15:20:01	android
674587800835092480	realDonaldTrump	I told you @TIME Magazine would never pick me as person of the year despite being the big favorite They picked person who is ruining Germany	2015-12-09 15:53:59	android
674610092344496128	realDonaldTrump	"Rupert Murdoch Defends Trump: 'Complete Refugee Pause' Makes Sense' " https://t.co/HWOLO4RVAC	2015-12-09 17:22:34	<a href="http://twitter.com" rel="nofollow">Twitter Web Client</a>
719476340576100353	realDonaldTrump	I will be interviewed on @foxandfriends at 7:00 A.M. Enjoy!	2016-04-11 13:45:01	android
719484455556161538	realDonaldTrump	"@TimeHasCome1: @WayneDupreeShow @ThePatriot143 Trump needs to hold a massive protest rally in Colorado. He'd get 100k &amp; own the news cycle"	2016-04-11 14:17:16	android
719484713182838784	realDonaldTrump	"@autoprofessor17: @realDonaldTrump Great job on Fox n Friends this morning. Very well spoken and presidential. #TrumpTrain"	2016-04-11 14:18:17	android
719484822834581504	realDonaldTrump	"@WVTTS1017: @realDonaldTrump just listened to you on fox. I love you so much."  Thank you!	2016-04-11 14:18:43	android
719500540657459201	realDonaldTrump	"@AnnesLimo: @realDonaldTrump @WVTTS1017 Thanks for Rochester rally."  Great people, thank you!	2016-04-11 15:21:11	android
730342411835195393	realDonaldTrump	Big wins in West Virginia and Nebraska. Get ready for November - Crooked Hillary, who is looking very bad against Crazy Bernie, will lose!	2016-05-11 13:22:54	android
730343346204508160	realDonaldTrump	I don't want to hit Crazy Bernie Sanders too hard yet because I love watching what he is doing to Crooked Hillary. His time will come!	2016-05-11 13:26:37	android
730401662574182405	realDonaldTrump	Goofy Elizabeth Warren has been one of the least effective Senators in the entire U.S. Senate. She has done nothing!	2016-05-11 17:18:21	<a href="http://twitter.com" rel="nofollow">Twitter Web Client</a>
745967990236143616	realDonaldTrump	Thank you to Donald Rumsfeld for the endorsement. Very much appreciated. Clinton's conduct has been "disqualifying."	2016-06-23 16:13:22	android
745969049943875585	realDonaldTrump	"Hillary Clinton may be the most corrupt person ever to seek the presidency."  --   Donald J. Trump	2016-06-23 16:17:35	android
745969778267926532	realDonaldTrump	ISIS threatens us today because of the decisions Hillary Clinton has made along with President Obama."  --  Donald J. Trump	2016-06-23 16:20:29	android
746026900502487040	realDonaldTrump	Hillary Lies to Benghazi Families #CrookedHillary  https://t.co/YWd5lk5skG	2016-06-23 20:07:28	iphone
790923701193768960	realDonaldTrump	As election looms, some bad news for Clinton, Democrats: https://t.co/7aWWVQPjTo	2016-10-25 17:31:19	iphone
790924363348541445	realDonaldTrump	#Obamacare premiums are about to SKYROCKET --- again. Crooked H will only make it worse. We will repeal &amp; replace! https://t.co/fY1REYV4rK	2016-10-25 17:33:57	iphone
790925502911578112	realDonaldTrump	#Obamacare premiums to jump 25% next year: https://t.co/TCdHEdPQDG  Follow us: @politico on Twitter | Politico on Facebook	2016-10-25 17:38:29	iphone
790925669937123328	realDonaldTrump	Key Obamacare premiums to jump 25% next year: https://t.co/TCdHEdPQDG	2016-10-25 17:39:09	iphone
790927104921767940	realDonaldTrump	Get out and vote! I am your voice and I will fight for you! We will make America great again! https://t.co/XXvLRlhSaz	2016-10-25 17:44:51	iphone
790936027871477764	realDonaldTrump	#ObamacareFail https://t.co/Mb0YW1rg6g	2016-10-25 18:20:18	iphone
790936360953716736	realDonaldTrump	#ObamacareFail https://t.co/5Zvsys8j5w	2016-10-25 18:21:37	iphone
790936603590033408	realDonaldTrump	Obamacare is a disaster! Time to repeal &amp; replace! #ObamacareFail  https://t.co/xDPhVczf1g	2016-10-25 18:22:35	iphone
790948782288596992	realDonaldTrump	#ObamacareFail https://t.co/90Aixp25Oc	2016-10-25 19:10:59	iphone
790951230906458113	realDonaldTrump	Obamacare is a disaster - as I've been saying from the beginning. Time to repeal &amp; replace!  #ObamacareFail https://t.co/5CvoMbVceT	2016-10-25 19:20:43	iphone
756798838900396032	realDonaldTrump	The Bernie Sanders supporters are furious with the choice of Tim Kaine, who represents the opposite of what Bernie stands for. Philly fight?	2016-07-23 13:31:18	android
756799923648102400	realDonaldTrump	Tim Kaine is, and always has been, owned by the banks. Bernie supporters are outraged, was their last choice. Bernie fought for nothing!	2016-07-23 13:35:37	android
756801575193042944	realDonaldTrump	Pocahontas wanted V.P. slot so badly but wasn't chosen because she has done nothing in the Senate. Also, Crooked Hillary hates her!	2016-07-23 13:42:10	android
756804886038192128	realDonaldTrump	Leaked e-mails of DNC show plans to destroy Bernie Sanders. Mock his heritage and much more. On-line from Wikileakes, really vicious. RIGGED	2016-07-23 13:55:20	android
756864330054893568	realDonaldTrump	Crooked Hillary Clinton has destroyed jobs and manufacturing in Pennsylvania. Against steelworkers and miners. Husband signed NAFTA.	2016-07-23 17:51:32	android
756866912848584704	realDonaldTrump	Funny that the Democrats would have their convention in Pennsylvania where her husband and her killed so many jobs. I will bring jobs back!	2016-07-23 18:01:48	android
756875689924694016	realDonaldTrump	Tim Kaine has been praising the Trans Pacific Partnership and has been pushing hard to get it approved. Job killer!	2016-07-23 18:36:41	android
756883131685273605	realDonaldTrump	I will bring jobs back and get wages up. People haven't had a real wage increase in almost twenty years. Clinton killed jobs!	2016-07-23 19:06:15	android
756952917152784384	realDonaldTrump	Just saw Crooked Hillary and Tim Kaine together. ISIS and our other enemies are drooling. They don't look presidential to me!	2016-07-23 23:43:33	android
756959549333143552	realDonaldTrump	The Wikileakes e-mail release today was so bad to Sanders that it will make it impossible for him to support her, unless he is a fraud!	2016-07-24 00:09:54	android
756962332228612096	realDonaldTrump	The Wikileaks e-mail release today was so bad to Sanders that it will make it impossible for him to support her, unless he is a fraud!	2016-07-24 00:20:58	iphone
756973646216884225	realDonaldTrump	Thank you to everyone for the wonderful reviews of my speech on Thursday night. From the heart!	2016-07-24 01:05:55	android
756974970312462336	realDonaldTrump	"@OliMauritania: @realDonaldTrump Kaine supported the stupidest deal in the history of deals https://t.co/0FFeKTsuJn #HillaryKaine2016"	2016-07-24 01:11:11	android
756975589110779904	realDonaldTrump	"@NancyNielsenn: @realDonaldTrump Dinesh D'Sousa Hillary's America. see it"	2016-07-24 01:13:39	android
757012114460569604	realDonaldTrump	#MakeAmericaGreatAgain #TrumpPence16 https://t.co/gCzHX1nyxD	2016-07-24 03:38:47	iphone
662559770398838784	realDonaldTrump	"@keksec_org: @realDonaldTrump Ivanka said it and you said it too, you'll be great for women. #MakeAmericaGreatAgain"	2015-11-06 11:18:53	android
662560463037841408	realDonaldTrump	"@SoCal4Trump: Wow @megynkelly. You openly LIE about who's ahead in the GOP race. Trump is LEADING in 99% of polls. Shameful... #StopTheLies	2015-11-06 11:21:38	android
662562140511985664	realDonaldTrump	A great honor to easily finish FIRST in the @FoxNews poll tabulation even though some of my best polls were not used in determining winner!	2015-11-06 11:28:18	android
662563472060850177	realDonaldTrump	"@DeeMcNa: @FoxNews Silent majority did not try to kill their mothers, like Ben Carson, but wants America rebuilt by only one capable:TRUMP"	2015-11-06 11:33:36	android
662564112581414913	realDonaldTrump	"@Rick_Saphire: @greta Interesting presidential race; Carson tries to beat his mom with a hammer, and @realDonaldTrump beats Carson polls.	2015-11-06 11:36:08	android
662564576265953280	realDonaldTrump	"@Rick_Sa: @greta Interesting presidential race; Carson tries to beat his mom with a hammer, and @realDonaldTrump beats Carson in the polls!	2015-11-06 11:37:59	android
662567885051699200	realDonaldTrump	"@reganharycki: @realDonaldTrump it's about time we find a republican that can take on the democrats! https://t.co/lfI1rUjWRV"	2015-11-06 11:51:08	android
662568726282268673	realDonaldTrump	"@GrundleMan27: Marco Rubio can't even handle his own credit card how is he going to be able to handle the U.S. finances #trump"	2015-11-06 11:54:28	android
662569633258541056	realDonaldTrump	"@AliceEngle3: @realDonaldTrump-huge lead in Reuters National poll https://t.co/afdvXHzvIx"	2015-11-06 11:58:05	android
662569952126349312	realDonaldTrump	"@rhinostate: .@realDonaldTrump @GrundleMan27 Rubio is a Manchurian Candidate. People will own him if he ever became president."	2015-11-06 11:59:21	android
662599915596554240	realDonaldTrump	Florida Ethics Commission Advocate comes down hard on Rubio. So do two people who worked with him. Said he used the wrong credit card! Sure.	2015-11-06 13:58:25	android
662600422339780608	realDonaldTrump	Will be interviewed on @MariaBartiromo on @FoxBusiness at 7:25 this morning! Enjoy.	2015-11-06 14:00:25	android
662604464830988288	realDonaldTrump	Such bad reporting: A puff piece on Ben Carson in the @nytimes states that Carson "is trying to solidify his lead." But I am #1, easily! Sad	2015-11-06 14:16:29	android
662606063624032257	realDonaldTrump	With Ben Carson wanting to hit his mother on head with a hammer, stabb a friend and Pyramids built for grain storage - don't people get it?	2015-11-06 14:22:50	android
662619382808489984	realDonaldTrump	Carson now admits his friend named "Bob," who he tried to stabb (Bob was saved by his belt buckle!), no longer exists as Bob. Wrong name!	2015-11-06 15:15:46	android
662632599962173440	realDonaldTrump	With Ben Carson wanting to hit his mother on head with a hammer, stab a friend and Pyramids built for grain storage - don't people get it?	2015-11-06 16:08:17	iphone
662632702227648512	realDonaldTrump	Carson now admits his friend named "Bob," who he tried to stab (Bob was saved by his belt buckle!), no longer exists as Bob. Wrong name!	2015-11-06 16:08:41	iphone
651245719190437888	realDonaldTrump	"@CASuperrunner: @cu_mr2ducks @FoxNews @foxnewspolitics  Trump talked about this weeks ago as a possibility .... this is not Rubio's idea"	2015-10-06 07:00:53	android
651350101823221760	realDonaldTrump	I will be interviewed on @CNN New Day at 7:03 A.M. Enjoy!	2015-10-06 13:55:40	android
651359165349281792	realDonaldTrump	"@LarrySchweikart: @peddoc63 @RickCanton @realDonaldTrump @marcorubio Funny. The Donald living rent-free in lil Marco's head"	2015-10-06 14:31:41	android
651359196563251200	realDonaldTrump	"@Karentalk: @CNNPolitics @realDonaldTrump Stop interrupting Trump..Please..He is CORRECT ON EVERYTHING.."	2015-10-06 14:31:48	android
651359270353698816	realDonaldTrump	"@LindaRicker6: My choice @realDonaldTrump just finished a great interview on CNN. Pathetic questions from Cuomo but Trump cleared the air."	2015-10-06 14:32:06	android
651359481864036352	realDonaldTrump	"@AngelaDale143: @realDonaldTrump @CNN wow, did Trump kick ass with Cuomo! You are the man, Mr. Trump; certainly not the lamb chop, Rubio."	2015-10-06 14:32:56	android
651359555528601600	realDonaldTrump	"@realbigstriper: @ChrisCuomo Pew poll: @realDonaldTrump holds commanding lead @CNNPolitics http://t.co/iw2vk9Wx9L"	2015-10-06 14:33:14	android
651359752484691968	realDonaldTrump	"@Lisa_Steen: seriously Cuomo hates DonaldTrump he was a pathetic interviewer AS USUAL! Please don't go anywhere Mr Trump AMERICA NEEDS YOU"	2015-10-06 14:34:01	android
651359857136824320	realDonaldTrump	"@Tea4Freedom: @realDonaldTrump @CNN That was awesome, boss! #trump2016"	2015-10-06 14:34:26	android
651360060396937216	realDonaldTrump	"@Nay_2xTimes: Great interview on #NewDay @realDonaldTrump #MakeAmericaGreatAgain"	2015-10-06 14:35:14	android
651360322201210880	realDonaldTrump	"@AJ_Nix: @realDonaldTrump @CNN Great job Mr Trump,,,Kept em on topic,, Got your message though."	2015-10-06 14:36:17	android
651360673180569604	realDonaldTrump	"@jpm05880: @realDonaldTrump @CNN TRUMP EVEN SHARPER THAN LAST WEEK!!YOU ARE BEAUTIFUL..."	2015-10-06 14:37:40	android
651360905578577920	realDonaldTrump	"@WMikeWood: @cnn Trump Shuts down Cuomo. "I am not getting out." I am going to win. Cuomo tries sleazy tricks . Epic Fail. Unprofessional."	2015-10-06 14:38:36	android
651361060960759808	realDonaldTrump	"@CPO_Mark_2010: @realDonaldTrump is fired up on @cnn!!! So are your supporters!! #Trump2016"	2015-10-06 14:39:13	android
651361170234994688	realDonaldTrump	"@SteveBrainard1: @realDonaldTrump @CNN great interview Trump!"	2015-10-06 14:39:39	android
651361204460519424	realDonaldTrump	"@kitkat123frank: @realDonaldTrump @CNN @SpecialKMB1969. You have my vote"	2015-10-06 14:39:47	android
651412375250280448	realDonaldTrump	.@WayneNewtonMrLV  Wayne, such a pleasant surprise--so nice. Thank you very much.	2015-10-06 18:03:07	<a href="http://twitter.com" rel="nofollow">Twitter Web Client</a>
629992743788523520	realDonaldTrump	So many "politically correct" fools in our country. We have to all get back to work and stop wasting time and energy on nonsense!	2015-08-08 15:29:09	android
629997060830425088	realDonaldTrump	Re Megyn Kelly quote: "you could see there was blood coming out of her eyes, blood coming out of her wherever" (NOSE). Just got on w/thought	2015-08-08 15:46:18	android
630007166129303552	realDonaldTrump	.@redstate I miss you all, and thanks for all of your support. Political correctness is killing our country. "weakness."	2015-08-08 16:26:28	iphone
630100913861099520	realDonaldTrump	Wow, CNN just said that Donald Trump won the DEBATE, connected best with audience. Also, Time, Drudge, Newsmax, N.Y.Times and more!	2015-08-08 22:38:59	android
630116339852673024	realDonaldTrump	Almost universal support that "Trump won the debate." Only @FoxNews is consistantly fighting the Trump win, and I got them the ratings!	2015-08-08 23:40:17	android
630223393774825472	realDonaldTrump	Small crowds at @RedState today in Atlanta. People were very angry at EWErickson, a major sleaze and buffoon who has saved me time and money	2015-08-09 06:45:40	android
825690087857995776	realDonaldTrump	Somebody with aptitude and conviction should buy the FAKE NEWS and failing @nytimes and either run it correctly or let it fold with dignity!	2017-01-29 15:00:32	android
825692045532618753	realDonaldTrump	Our country needs strong borders and extreme vetting, NOW. Look what is happening all over Europe and, indeed, the world - a horrible mess!	2017-01-29 15:08:18	android
683259029804695552	realDonaldTrump	.@JebBush is a sad case. A total embarrassment to both himself and his family, he just announced he will continue to spend on Trump hit ads!	2016-01-02 14:10:21	android
683260753810440192	realDonaldTrump	.@JebBush is a low energy "stiff" who should focus his special interest money on the many people ahead of him in the polls. Has no chance!	2016-01-02 14:17:12	android
683277309969694720	realDonaldTrump	Hillary Clinton said that it is O.K. to ban Muslims from Israel by building a WALL, but not O.K. to do so in the U.S. We must be vigilant!	2016-01-02 15:23:00	android
683377290282156032	realDonaldTrump	Hillary Clinton doesn't have the strength or stamina to be president. Jeb Bush is a low energy individual, but Hillary is not much better!	2016-01-02 22:00:17	android
683378470093746176	realDonaldTrump	I hope Bill Clinton starts talking about women's issues so that voters can see what a hypocrite he is and how Hillary abused those women!	2016-01-02 22:04:58	android
683392613869858816	realDonaldTrump	When I look at all of the money the special interests and lobbyists are giving to candidates, beware - the candidates are mere puppets $$$$!	2016-01-02 23:01:10	android
683394224184758272	realDonaldTrump	Remember, I am self-funding my campaign, the only one in either party. I'm not controlled by lobbyists or special interests-only the U.S.A.!	2016-01-02 23:07:34	android
683418056417251328	realDonaldTrump	Heading to Biloxi, Mississippi. Massive crowds expected. Thank you for your support! #VoteTrump2016 https://t.co/1VMngEMLzT	2016-01-03 00:42:16	iphone
683443848639455232	realDonaldTrump	Just arrived in Mississippi for the rally. Word is that the crowd is overflowing and massive. Will be an amazing evening!	2016-01-03 02:24:45	android
668402717241548800	realDonaldTrump	Will be interviewed on @foxandfriends at 8:00 A.M.	2015-11-22 14:16:40	android
668405215654240256	realDonaldTrump	.@GStephanopoulos just announced that I am leading  BIG in the new @ABC Poll which will be shown on This Week at 9:00 A.M. I will be on show	2015-11-22 14:26:36	android
668406922232659968	realDonaldTrump	Big new @ABC Poll to be announced at 9:00 A.M. on This Week with @GStephanopoulos. I will be interviewed on show!	2015-11-22 14:33:23	android
668410956725272576	realDonaldTrump	.@foxandfriends  at 8:00 A.M.	2015-11-22 14:49:25	android
668441539643899905	realDonaldTrump	Great poll numbers all over and beating Hillary Clinton one on one. Thank you!	2015-11-22 16:50:56	android
668457318267400193	realDonaldTrump	13 Syrian refugees were caught trying to get into the U.S. through the Southern Border. How many made it?  WE NEED THE WALL!	2015-11-22 17:53:38	android
668458837670805504	realDonaldTrump	We better get tough with RADICAL ISLAMIC TERRORISTS, and get tough now, or the life and safety of our wonderful country will be in jeopardy!	2015-11-22 17:59:40	android
668495716139036673	realDonaldTrump	Great poll numbers! Thank you! #MakeAmericaGreatAgain #Trump2016 https://t.co/51CRR6m5Eg	2015-11-22 20:26:13	iphone
668519137765928960	realDonaldTrump	"@heiressarts: @realDonaldTrump By going after you, Jindal also lost the LA governor race! Politicians Beware.	2015-11-22 21:59:17	android
668520614697820160	realDonaldTrump	"@SeanSean252: @WayneDupreeShow @Rockprincess818 @CheriJacobus    https://t.co/5GUwhhtvyN"	2015-11-22 22:05:09	android
668520845028040704	realDonaldTrump	"@jakub_lisa:  @HillaryClinton A Clinton Cannot be trusted!How many x's do we allow them to disgrace this country? #NoClintonInWHEverAgain"	2015-11-22 22:06:04	android
668521121411678208	realDonaldTrump	"@drewtheg:  Trump is the epitome of integrity, good spirit, forthright honesty... you pull no punches and call a spade a spade. diggin it!"	2015-11-22 22:07:10	android
668556086547496960	realDonaldTrump	"@TheFix: The Paris attacks have only made Donald Trump stronger https://t.co/F8vgxYNa5t https://t.co/Y3SevhrRp1" Very interesting!	2015-11-23 00:26:06	android
668557606189944832	realDonaldTrump	"@MJP1370: @realDonaldTrump @TheFix @pbump We need Trump now! Obama isn't protecting Americans !!"	2015-11-23 00:32:09	android
668557747336687616	realDonaldTrump	"@bloggerjulie: @FoxNews The reporter is the one who mentioned the national database FIRST and not DonaldTrump. Y not report HONEST NEWS?"	2015-11-23 00:32:42	android
668557999179472896	realDonaldTrump	"@jrpantiques: @realDonaldTrump @TheFix @pbump THE SCRIPT FOR A GREAT WORLD CHANGING LEADER TO ARISE HAS BEEN WRITTEN &amp; IT WAS FOR MR. TRUMP	2015-11-23 00:33:42	android
668560227772604416	realDonaldTrump	"@ktd101551: @CNNPolitics Trump gave a great speech in Ala. What's more important a protester? I wouldn't give these folks 1 sec of attn"	2015-11-23 00:42:34	android
668561163920277504	realDonaldTrump	"@ny_conservative:  @BarbMuenchen #CrippledAmerica is an excellent resource for the 2016 race #TeamTrump #Trump2016 #MakeAmericaGreatAgain"	2015-11-23 00:46:17	android
668563843904380928	realDonaldTrump	Hillary Clinton is weak on illegal immigration, among many other things. She is strong on corruption - corruption is what she's best at!	2015-11-23 00:56:56	android
668594331968778241	realDonaldTrump	.@MatthewJDowd thank you for the nice comments recently, especially on @BarbaraJWalters. My family &amp; I greatly appreciate your kind words.	2015-11-23 02:58:05	iphone
657224175707385856	realDonaldTrump	"@mygreenhippo #BenCarson is now leading in the #polls in #Iowa. Too much #Monsanto in the #corn creates issues in the brain? #Trump #GOP"	2015-10-22 18:57:08	<a href="http://twitter.com" rel="nofollow">Twitter Web Client</a>
657228886007263233	realDonaldTrump	"Trump Nears 100 days on Top" via The Hill https://t.co/MDzpY89TRE	2015-10-22 19:15:51	<a href="http://twitter.com" rel="nofollow">Twitter Web Client</a>
657231408813993984	realDonaldTrump	#ChrisWallace, who interviewed me on Sunday, had his highest ratings since Feb of '09. Congratulations!  https://t.co/o49V73AZZB	2015-10-22 19:25:53	<a href="http://twitter.com" rel="nofollow">Twitter Web Client</a>
657235829413289984	realDonaldTrump	"@toddinwichita @realDonaldTrump Hillary is doing a HORRIBLE job at #BenghaziHearings reading from the script. #pathetic . She is no leader"	2015-10-22 19:43:27	<a href="http://twitter.com" rel="nofollow">Twitter Web Client</a>
